{"schema_version":"1.0","requested_window":{"start_ms":1789473300000,"end_ms":1789473600000},"effective_window":{"start_ms":1789473305000,"end_ms":1789473600000},"sources":[{"source_id":"33333333-3333-4333-8333-333333333333","valid_duration_ms":295000,"requested_duration_ms":300000,"coverage_ratio":0.9833333333,"state":"partial"}],"gaps":[{"source_id":"33333333-3333-4333-8333-333333333333","start_ms":1789473300000,"end_ms":1789473305000,"reason":"collection_gap","lost_count":1}],"clock":{"method":"single_host_monotonic_aligned","cross_host_ordering":"available","max_uncertainty_ms":4,"discontinuities":0}}
